,6/19/26,6/20/26,6/21/26,6/22/26,6/23/26,6/24/26,6/25/26,6/26/26,6/27/26
Breakfast,Breakfast at Home,Near Hotel,AirBNB,Airbnb,Airbnb,Airbnb,Airbnb,Out to Breakfast,Fast food
Lunch,Fast food,Lunch on the road,Sandwiches at Airbnb,Quarterdeck,Beach picnic,Skull Creek Boathouse,Sandwiches at Airbnb,The Crazy Crab,fast food
Dinner,Mexican near hotel,Pizza delivery at Airbnb,Burgers at Airbnb,Local Legends,Tacos at Airbnb,Chicken Alfredo at Airbnb,Hudson's Seafood House on the Docks,Skull Creek Dockside,fast food
AM Actiivites,N/A,Drive to Hilton Head,Relax at Airbnb,Visit Harbour Town Lighthouse,Relax on the beach,Bike ride along the trails,Beach time,Souvenir shopping,Drive
PM Activites,Drive to Charlotte,Arrive in Hilton Head & Check-in,Explore Coligny Plaza,Walk around Sea Pines,Shelter Cove Towne Centre,Relax at Airbnb,Salty Dog Cafe & South Beach Marina,Harbour Town sunset,Drive
Kid activities,N/A,Settle in & Pool time,Beach Morning 1,Pirate Island Mini Golf,Beach Morning 2,Coastal Discovery Museum,Beach Morning 3,Gregg Russell Family Concert,N/A